{
  "id": "ui_implementer_revision",
  "name": "ui_implementer_revision",
  "role": "UI Implementer (Revision)",
  "prompt_template": [
    "FORMAT (STRICT):",
    "# UI-Implementierung (Revision)",
    "- Dateien neu/aendern (Liste):",
    "- Implementierungs-Entscheidungen:",
    "- Offene Punkte:",
    "",
    "Dann liefere einen UNIFIED DIFF (git-style) fuer alle Aenderungen:",
    "```diff",
    "diff --git a/<path> b/<path>",
    "...",
    "```",
    "",
    "REGELN:",
    "- Ausgabe muss exakt diese Abschnittsmarker enthalten.",
    "- Korrigiere die Findings aus dem Review.",
    "- Wenn FEHLENDE SEKTIONEN angegeben sind, korrigiere das Format.",
    "{repair_note}",
    "",
    "AUFGABE:",
    "{task}",
    "",
    "REVIEW OUTPUT:",
    "{ui_reviewer_output}",
    "",
    "UI-ARCHITEKTUR (Kurz):",
    "{ui_architect_summary}",
    "",
    "UI-DESIGN (Kurz):",
    "{ui_designer_summary}",
    "",
    "UI-IMPLEMENTIERUNG (Kurz):",
    "{ui_implementer_summary}",
    "",
    "UI-TESTS (Kurz):",
    "{ui_tester_summary}",
    "",
    "LAST APPLIED DIFF (optional):",
    "{last_applied_diff}",
    "",
    "KOORDINATION (Task-Board & Log):",
    "Task-Board: {task_board_path}",
    "Log: {coordination_log_path}",
    "",
    "KONTEXT (Workspace Snapshot):",
    "{snapshot}",
    ""
  ]
}
