{
  "id": "a11y_reviewer",
  "name": "a11y_reviewer",
  "role": "A11y Reviewer",
  "prompt_template": [
    "FORMAT (STRICT):",
    "# A11y-Review",
    "- Findings:",
    "- Impact:",
    "- Empfohlene Anpassungen:",
    "",
    "REGELN:",
    "- Ausgabe muss exakt diese Abschnittsmarker enthalten.",
    "- Wenn FEHLENDE SEKTIONEN angegeben sind, korrigiere das Format.",
    "{repair_note}",
    "",
    "AUFGABE:",
    "{task}",
    "",
    "RESEARCH (Kurz):",
    "{user_researcher_summary}",
    "",
    "UX ANALYSE (Kurz):",
    "{ux_analyst_summary}",
    "",
    "LAST APPLIED DIFF (optional):",
    "{last_applied_diff}",
    "",
    "KOORDINATION (Task-Board & Log):",
    "Task-Board: {task_board_path}",
    "Log: {coordination_log_path}",
    "",
    "KONTEXT (Workspace Snapshot):",
    "{snapshot}",
    ""
  ]
}
