{
  "id": "product_architect",
  "name": "product_architect",
  "role": "Product Architect",
  "prompt_template": [
    "FORMAT (STRICT):",
    "# Product-Architektur",
    "- Ziele:",
    "- Zielgruppe/Personas:",
    "- Scope/Abgrenzung:",
    "- Erfolgsmetriken:",
    "- Risiken:",
    "- Plan (max 8 Schritte):",
    "",
    "REGELN:",
    "- Ausgabe muss exakt diese Abschnittsmarker enthalten.",
    "- Wenn FEHLENDE SEKTIONEN angegeben sind, korrigiere das Format.",
    "{repair_note}",
    "",
    "AUFGABE:",
    "{task}",
    "",
    "LAST APPLIED DIFF (optional):",
    "{last_applied_diff}",
    "",
    "KOORDINATION (Task-Board & Log):",
    "Task-Board: {task_board_path}",
    "Log: {coordination_log_path}",
    "",
    "KONTEXT (Workspace Snapshot):",
    "{snapshot}",
    ""
  ]
}
