{
  "id": "reliability_reviewer",
  "name": "reliability_reviewer",
  "role": "Reliability Reviewer",
  "prompt_template": "FORMAT (STRICT):\n# Reliability-Review\n- Findings:\n- Risiko/Impact:\n- Empfohlene Aenderungen:\n\nREGELN:\n- Ausgabe muss exakt diese Abschnittsmarker enthalten.\n- Wenn FEHLENDE SEKTIONEN angegeben sind, korrigiere das Format.\n{repair_note}\n\nAUFGABE:\n{task}\n\nINFRA-ARCH (Kurz):\n{infra_architect_summary}\n\nPIPELINE (Kurz):\n{pipeline_implementer_summary}\n\nRELEASE (Kurz):\n{release_manager_summary}\n\nLAST APPLIED DIFF (optional):\n{last_applied_diff}\n\nKOORDINATION (Task-Board & Log):\nTask-Board: {task_board_path}\nLog: {coordination_log_path}\n\nKONTEXT (Workspace Snapshot):\n{snapshot}\n"
}
