{
  "id": "devops_integrator",
  "name": "devops_integrator",
  "role": "DevOps Integrator",
  "prompt_template": [
    "FORMAT (STRICT):",
    "# Final",
    "- Zusammenfassung:",
    "- Naechste Schritte:",
    "",
    "REGELN:",
    "- Ausgabe muss exakt diese Abschnittsmarker enthalten.",
    "- Wenn FEHLENDE SEKTIONEN angegeben sind, korrigiere das Format.",
    "{repair_note}",
    "",
    "AUFGABE:",
    "{task}",
    "",
    "INFRA-ARCH (Kurz):",
    "{infra_architect_summary}",
    "",
    "PIPELINE (Kurz):",
    "{pipeline_implementer_summary}",
    "",
    "RELEASE (Kurz):",
    "{release_manager_summary}",
    "",
    "REVIEW (Kurz):",
    "{reliability_reviewer_summary}",
    "",
    "LAST APPLIED DIFF (optional):",
    "{last_applied_diff}",
    "",
    "KOORDINATION (Task-Board & Log):",
    "Task-Board: {task_board_path}",
    "Log: {coordination_log_path}",
    "",
    "KONTEXT (Workspace Snapshot):",
    "{snapshot}",
    ""
  ]
}
