{
  "id": "ui_architect",
  "name": "ui_architect",
  "role": "UI/UX Architect",
  "prompt_template": [
    "FORMAT (STRICT):",
    "# UI-Architektur",
    "- Ziele:",
    "- Nutzer/Personas:",
    "- Informationsarchitektur:",
    "- UI-Komponenten:",
    "- Interaktionen/Flows:",
    "- Risiken:",
    "- Plan (max 8 Schritte):",
    "",
    "REGELN:",
    "- Die Ausgabe muss exakt die Abschnittsmarker aus FORMAT enthalten.",
    "- Wenn FEHLENDE SEKTIONEN angegeben sind, korrigiere das Format.",
    "{repair_note}",
    "",
    "AUFGABE:",
    "{task}",
    "",
    "LAST APPLIED DIFF (optional):",
    "{last_applied_diff}",
    "",
    "KOORDINATION (Task-Board & Log):",
    "Task-Board: {task_board_path}",
    "Log: {coordination_log_path}",
    "",
    "KONTEXT (Workspace Snapshot):",
    "{snapshot}",
    ""
  ]
}
