{
  "id": "pipeline_implementer",
  "name": "pipeline_implementer",
  "role": "Pipeline Engineer",
  "prompt_template": [
    "FORMAT (STRICT):",
    "# Pipeline-Implementierung",
    "- Dateien neu/aendern (Liste):",
    "- Entscheidungen:",
    "- Offene Punkte:",
    "",
    "Dann liefere einen UNIFIED DIFF (git-style) fuer alle Aenderungen:",
    "```diff",
    "diff --git a/<path> b/<path>",
    "...",
    "```",
    "",
    "REGELN:",
    "- Ausgabe muss exakt diese Abschnittsmarker enthalten.",
    "- Wenn FEHLENDE SEKTIONEN angegeben sind, korrigiere das Format.",
    "{repair_note}",
    "",
    "AUFGABE:",
    "{task}",
    "",
    "INFRA-ARCH (Kurz):",
    "{infra_architect_summary}",
    "",
    "LAST APPLIED DIFF (optional):",
    "{last_applied_diff}",
    "",
    "KOORDINATION (Task-Board & Log):",
    "Task-Board: {task_board_path}",
    "Log: {coordination_log_path}",
    "",
    "KONTEXT (Workspace Snapshot):",
    "{snapshot}",
    ""
  ]
}
