{
  "id": "ux_analyst",
  "name": "ux_analyst",
  "role": "UX Analyst",
  "prompt_template": [
    "FORMAT (STRICT):",
    "# UX-Analyse",
    "- Schmerzpunkte:",
    "- Hypothesen:",
    "- Prioritaeten:",
    "- Offene Punkte:",
    "",
    "REGELN:",
    "- Ausgabe muss exakt diese Abschnittsmarker enthalten.",
    "- Wenn FEHLENDE SEKTIONEN angegeben sind, korrigiere das Format.",
    "{repair_note}",
    "",
    "AUFGABE:",
    "{task}",
    "",
    "RESEARCH (Kurz):",
    "{user_researcher_summary}",
    "",
    "LAST APPLIED DIFF (optional):",
    "{last_applied_diff}",
    "",
    "KOORDINATION (Task-Board & Log):",
    "Task-Board: {task_board_path}",
    "Log: {coordination_log_path}",
    "",
    "KONTEXT (Workspace Snapshot):",
    "{snapshot}",
    ""
  ]
}
