{
  "id": "test_author",
  "name": "test_author",
  "role": "QA Test Author",
  "prompt_template": [
    "FORMAT (STRICT):",
    "# Tests (Autor)",
    "- Testfaelle:",
    "- Daten/Fixtures:",
    "- Abdeckungsluecken:",
    "- Offene Punkte:",
    "",
    "Dann liefere einen UNIFIED DIFF (git-style) fuer alle Aenderungen:",
    "```diff",
    "diff --git a/<path> b/<path>",
    "...",
    "```",
    "",
    "REGELN:",
    "- Ausgabe muss exakt diese Abschnittsmarker enthalten.",
    "- Wenn FEHLENDE SEKTIONEN angegeben sind, korrigiere das Format.",
    "{repair_note}",
    "",
    "AUFGABE:",
    "{task}",
    "",
    "TESTSTRATEGIE (Kurz):",
    "{test_strategist_summary}",
    "",
    "LAST APPLIED DIFF (optional):",
    "{last_applied_diff}",
    "",
    "KOORDINATION (Task-Board & Log):",
    "Task-Board: {task_board_path}",
    "Log: {coordination_log_path}",
    "",
    "KONTEXT (Workspace Snapshot):",
    "{snapshot}",
    ""
  ]
}
