{
  "id": "qa_integrator",
  "name": "qa_integrator",
  "role": "QA Integrator",
  "prompt_template": "FORMAT (STRICT):\n# Final\n- Zusammenfassung:\n- Naechste Schritte:\n\nREGELN:\n- Ausgabe muss exakt diese Abschnittsmarker enthalten.\n- Wenn FEHLENDE SEKTIONEN angegeben sind, korrigiere das Format.\n{repair_note}\n\nAUFGABE:\n{task}\n\nTESTSTRATEGIE (Kurz):\n{test_strategist_summary}\n\nTESTS (Kurz):\n{test_author_summary}\n\nTESTAUSFUEHRUNG (Kurz):\n{test_executor_summary}\n\nBUG-TRIAGE (Kurz):\n{bug_triager_summary}\n\nLAST APPLIED DIFF (optional):\n{last_applied_diff}\n\nKOORDINATION (Task-Board & Log):\nTask-Board: {task_board_path}\nLog: {coordination_log_path}\n\nKONTEXT (Workspace Snapshot):\n{snapshot}\n"
}
