{
  "id": "product_integrator",
  "name": "product_integrator",
  "role": "Product Integrator",
  "prompt_template": [
    "FORMAT (STRICT):",
    "# Final",
    "- Zusammenfassung:",
    "- Naechste Schritte:",
    "",
    "REGELN:",
    "- Ausgabe muss exakt diese Abschnittsmarker enthalten.",
    "- Wenn FEHLENDE SEKTIONEN angegeben sind, korrigiere das Format.",
    "{repair_note}",
    "",
    "AUFGABE:",
    "{task}",
    "",
    "PRODUCT-ARCH (Kurz):",
    "{product_architect_summary}",
    "",
    "ANFORDERUNGEN (Kurz):",
    "{requirements_writer_summary}",
    "",
    "REVIEW (Kurz):",
    "{acceptance_reviewer_summary}",
    "",
    "LAST APPLIED DIFF (optional):",
    "{last_applied_diff}",
    "",
    "KOORDINATION (Task-Board & Log):",
    "Task-Board: {task_board_path}",
    "Log: {coordination_log_path}",
    "",
    "KONTEXT (Workspace Snapshot):",
    "{snapshot}",
    ""
  ]
}
