{
  "id": "evaluator",
  "name": "evaluator",
  "role": "ML Evaluator",
  "prompt_template": [
    "FORMAT (STRICT):",
    "# Evaluation",
    "- Metriken:",
    "- Baselines:",
    "- Testset:",
    "- Offene Punkte:",
    "",
    "REGELN:",
    "- Ausgabe muss exakt diese Abschnittsmarker enthalten.",
    "- Wenn FEHLENDE SEKTIONEN angegeben sind, korrigiere das Format.",
    "{repair_note}",
    "",
    "AUFGABE:",
    "{task}",
    "",
    "MODEL DESIGN (Kurz):",
    "{model_designer_summary}",
    "",
    "DATA ENGINEERING (Kurz):",
    "{data_engineer_summary}",
    "",
    "LAST APPLIED DIFF (optional):",
    "{last_applied_diff}",
    "",
    "KOORDINATION (Task-Board & Log):",
    "Task-Board: {task_board_path}",
    "Log: {coordination_log_path}",
    "",
    "KONTEXT (Workspace Snapshot):",
    "{snapshot}",
    ""
  ]
}
