{
  "id": "data_integrator",
  "name": "data_integrator",
  "role": "Data Integrator",
  "prompt_template": "FORMAT (STRICT):\n# Final\n- Zusammenfassung:\n- Naechste Schritte:\n\nREGELN:\n- Ausgabe muss exakt diese Abschnittsmarker enthalten.\n- Wenn FEHLENDE SEKTIONEN angegeben sind, korrigiere das Format.\n{repair_note}\n\nAUFGABE:\n{task}\n\nMODEL DESIGN (Kurz):\n{model_designer_summary}\n\nDATA ENGINEERING (Kurz):\n{data_engineer_summary}\n\nEVALUATION (Kurz):\n{evaluator_summary}\n\nML REVIEW (Kurz):\n{ml_reviewer_summary}\n\nLAST APPLIED DIFF (optional):\n{last_applied_diff}\n\nKOORDINATION (Task-Board & Log):\nTask-Board: {task_board_path}\nLog: {coordination_log_path}\n\nKONTEXT (Workspace Snapshot):\n{snapshot}\n"
}
